{
  "$schema": "http://json-schema.org/draft-07/schema#",
  "title": "Q-CLAW Skill Manifest",
  "description": "Schema for skill.json files submitted to the Q-CLAW registry",
  "type": "object",
  "required": ["name", "version", "description", "author", "category", "tools", "transport"],
  "properties": {
    "name": {
      "type": "string",
      "pattern": "^@?[a-z0-9-]+/[a-z0-9-]+$",
      "description": "Scoped package name: @scope/name or org/name"
    },
    "version": {
      "type": "string",
      "pattern": "^\\d+\\.\\d+\\.\\d+",
      "description": "Semantic version: X.Y.Z"
    },
    "description": {
      "type": "string",
      "maxLength": 200
    },
    "author": {
      "type": "object",
      "required": ["name"],
      "properties": {
        "name": { "type": "string" },
        "url": { "type": "string", "format": "uri" }
      }
    },
    "license": {
      "type": "string",
      "default": "MIT"
    },
    "category": {
      "type": "string",
      "enum": ["web-data", "code-dev", "communication", "knowledge", "creative", "enterprise"]
    },
    "tags": {
      "type": "array",
      "items": { "type": "string" },
      "maxItems": 10,
      "default": []
    },
    "icon": { "type": "string" },
    "pricing": {
      "type": "object",
      "properties": {
        "model": { "type": "string", "enum": ["free", "paid", "freemium"], "default": "free" }
      },
      "default": { "model": "free" }
    },
    "tools": {
      "type": "array",
      "minItems": 1,
      "items": {
        "type": "object",
        "required": ["name", "description", "inputSchema"],
        "properties": {
          "name": { "type": "string", "minLength": 1 },
          "description": { "type": "string", "maxLength": 200 },
          "inputSchema": { "type": "object" },
          "annotations": {
            "type": "object",
            "properties": {
              "readOnly": { "type": "boolean" },
              "destructive": { "type": "boolean" },
              "idempotent": { "type": "boolean" },
              "openWorld": { "type": "boolean" }
            }
          }
        }
      }
    },
    "transport": {
      "type": "object",
      "required": ["type"],
      "properties": {
        "type": { "type": "string", "enum": ["stdio", "streamable-http"] },
        "command": { "type": "string" },
        "args": { "type": "array", "items": { "type": "string" } },
        "url": { "type": "string", "format": "uri" },
        "env": {
          "type": "object",
          "additionalProperties": {
            "type": "object",
            "properties": {
              "required": { "type": "boolean", "default": false },
              "secret": { "type": "boolean", "default": false },
              "description": { "type": "string" }
            }
          }
        }
      }
    },
    "compatibility": {
      "type": "object",
      "properties": {
        "qclaw": { "type": "string", "default": ">=2.0.0" },
        "node": { "type": "string", "default": ">=20.0.0" }
      },
      "default": { "qclaw": ">=2.0.0", "node": ">=20.0.0" }
    },
    "dependencies": {
      "type": "object",
      "additionalProperties": { "type": "string" },
      "default": {}
    }
  }
}
